{
  "$schema": "https://opennoodl.dev/schemas/component-v2.json",
  "id": "c7e41a90-0000-4000-8000-000000000022",
  "name": "StatusRail",
  "path": "/Components/StatusRail",
  "type": "visual",
  "modified": "2026-09-09T14:00:00.000Z",
  "description": "HLS-005 fixture: issue #23's own table, reconstructed — one component input reaching three sinks of which two translate, beside a second input reaching a dimension port that does not."
}
