{
  "$schema": "https://opennoodl.dev/schemas/component-v2.json",
  "id": "c0a1b2c3-5b3f-4e8d-9c1a-000000000063",
  "name": "PanelRow",
  "path": "/Components/PanelRow",
  "type": "visual",
  "created": "2026-09-05T09:00:00.000Z",
  "modified": "2026-09-05T09:00:00.000Z",
  "description": "EXP-011 §60 fixture: a repeated row that shows its own name and the parent page's title through Parent Component Object — the context reaches a For Each template row."
}
