{
  "$schema": "https://opennoodl.dev/schemas/component-v2.json",
  "id": "e7a1c4d2-5b3f-4e8d-9c1a-000000000098",
  "name": "Home",
  "path": "/Pages/Home",
  "type": "page",
  "modified": "2026-09-05T10:00:00.000Z",
  "description": "EXP-011 \u00a761 fixture: a tab bar drives a Component Stack \"Tabs\" in Replace mode; a wizard Component Stack \"Main\" starts on StepIntro; its top name and depth are two Texts; a Variable the wizard confirms is a third; a button resets the wizard."
}
