{
  "$schema": "https://opennoodl.dev/schemas/component-v2.json",
  "id": "2be34465-a6da-534b-80cc-aa999ec2f55b",
  "name": "TrustItem",
  "path": "/Components/TrustItem",
  "type": "visual",
  "created": "2026-08-31T00:00:00.000Z",
  "modified": "2026-08-31T00:00:00.000Z",
  "modifiedBy": "vib-004"
}
