{
  "$schema": "https://opennoodl.dev/schemas/component-v2.json",
  "id": "e190644a-d3a1-513f-859a-fcd41ea4cd7c",
  "name": "Unsubscribe",
  "path": "/Pages/Unsubscribe",
  "type": "page",
  "created": "2026-08-28T00:00:00.000Z",
  "modified": "2026-08-28T00:00:00.000Z",
  "modifiedBy": "noodl-mcp"
}
